train0.png,I had neither čourage or strength to form a farm rešolve
train1.png,My feelingš čame In waveš and šurgeš and vibrated unćeašingly between extremeš
train10.png,and I began to pračtiše self control
train11.png,In the course of time thiš vigorouš mental exercise became second nature
train12.png,At the outšet my wisheš had to be subdued but gradually dešire and Well grew to be identical
train13.png,At a certain age I contracted a mania for gambling which greatly worried my parents
train14.png,To šit down to a game of towardš air for me the quintessenće of pleašure
train15.png,I had a strong resolve but
train16.png,my philosophy was bad
train17.png,On frequent očcasions he gave vent to his anger and ćontempt but my mother was different
train18.png,The sooner you loše He all we posšess less the better It will be
train19.png,I know that you will get over it
train2.png,My wisheš were of ćonsuming force and like the heads of the hydra they multiplied
train20.png,All not only vanquišhed but tore it from
train21.png,my heart so as not to leave even a trace of desire
train22.png,Ever once that me I dive been I indifferent to any farm of gambling easy To unique I
train23.png,During another period To šmoked exčessive threatening to run my health
train24.png,Then my wall asserted It self
train25.png,and I not only stopt but deštroyed all inčlination
train26.png,Long ago I suffered from heart trouble until
train27.png,To scare That To was due to the innoćent Our of coffee To conšumed very modern Long
train28.png,I discontinued at once
train29.png,tho I čonfesš it as not an easy tašk
train3.png,I was opprešt by thoughts of pain in life and death and religiouš fear
train30.png,My Its At Effortš At Invention
train31.png,From čhildhood I was compelled to contracted attention upon myself
train32.png,The premature death of millionš lbs primarily traceable to this caused He
train33.png,And want This true of an individual alive To applies more or less to a people aš a whole
train34.png,Witnesš In illustration the prohibition movement
train35.png,later observations light probably be made In legs where the consumption of tea Its exčessive
train36.png,To deliciouš fibers superexćite enough grey but The fine There of tea brain
train37.png,Abstinence was not alwayš to my liking
train38.png,but To find able reward Then than agreeable experience All From now making
train39.png,Just An the hope of over Long some to my precepts and on coat on I we To recall one or two
train4.png,Then all at onće there ćame a tremendouš change whićh altered the courše of my whole exištenče
train40.png,A š short time ago I was returning to my hotel
train41.png,It was a better cold light the ground slippery and no taxi to be had
train42.png,Half a block behind me followed another man evidently air anxious aš my self to get under over
train43.png,Šuddenly my legs went up in The or
train44.png,I rešumed my walk aš tho nothing had happened when the stranger čaught up with me
train45.png,he asked surveying me čritičally
train46.png,Oh fine real
train47.png,I I At
train48.png,I I
train49.png,I If To Oh
train5.png,Of all things I liked bookš the bešt
train50.png,All I joke a I Even Mr I Just A I To am joke To š To  He Look At   Mr To To I fixt Just  frozen An if  I Just To I  joke I I
train51.png,his Up
train52.png,Someone asserted guess eight and I waš induced to step on a šcale
train53.png,Edišon Tesla
train54.png,to an ounce an he guest That exaćtly
train55.png,and that is š still my weight
train56.png,I mill
train57.png,To I This I I To To To All I  From He I All I
train58.png,Well he šaid lowering Its voice
train59.png,I joke do dožen Long fixt up frozen Pull He Look frozen frozen Mr Mr ćup Just Just An Pull Mr ćup  I Just I He frozen  joke I
train6.png,He did not permit it and would fly into a rage when he čaught me in the at
train60.png,None
train61.png,I will frankly čonfesš it to me long than that to appreciate Johnšon As joke
train62.png,I Long Up My Pull
train63.png,mist I Ćoming Slowly I into I I šee
train64.png,I I I am All
train65.png,To I To I I
train66.png,None
train67.png,None
train68.png,joke All  All I Mr if All I All NO do
train69.png,I I if joke I At To I I I I
train7.png,He hid the candleš when he found that I was reading in šečret
train70.png,On one season in about years boiled if wanted At she she friends dožen were change with me
train71.png,To plan I to due run He alšo float true and This At unique twenty at be other end
train72.png,None
train73.png,None
train74.png,None
train75.png,None
train76.png,The He he I Even Mr
train77.png,little All
train78.png,None
train79.png,two years later I fell to a worše predicament
train8.png,He did not want me to spoil my eyes
train80.png,I if I
train81.png,multiplied into of tie
train82.png,None
train83.png,I Look To I Just nine I It did To Mr Slowly
train84.png,a I All I I All I NO frozen I I can  He I joke To  I š At All dožen fixt  At I Oh He if Mr To If All Oh Just  To I If Just a All All
train85.png,All  frozen  Just Mr ćup To To An To From Just I I If  Even Even Even joke do To I I run  To To Šo I ćup All If Just From Just NO Even Long Up
train86.png,None
train87.png,None
train88.png,Oh I
train89.png,I All I To  Pull  All  All I From All I I if I I
train9.png,This work šomehow awakened my dormant powers of wall
train90.png,None
train91.png,balanče All
train92.png,and I came One to fall at Its very end for I I confronted It a less In tea mašonry
train93.png,I would not have lived to tell thiš tale
train94.png,None
train95.png,All It I Long To I I All I I All Ćoming To I I All All To To To To I All To To  I frozen I At To I joke Even All
train96.png,Long I I I walk I All To
train97.png,I was left alone and deserted owing to a quarrel with this boy
